user_input,retrieved_contexts,response,reference,faithfulness,answer_relevancy,llm_context_precision_with_reference,context_recall,factual_correctness,is_weak_case,weak_reasons
Cuộc họp để trao đổi về kết quả kinh doanh Q1/2026 sẽ diễn ra vào ngày nào?,"['Title: TÓM TẮT KẾT QUẢ KINH DOANH HỢP NHẤT Q1/2026 ĐÃ KIỂM TOÁN:\nSource: 20260429_VNM_Ban_tin_NDT_Q1_2026.pdf\nTÓM TẮT KẾT QUẢ KINH DOANH HỢP NHẤT Q1/2026 ĐÃ KIỂM TOÁN:\n\n(Tỷ đồng) Q1/2026 Q1/2025\n % tăng/\n(giảm)\nDoanh thu thuần 16.149 12.958 \uf0e1 24,6%\n- Trong nước 12.080 10.032 \uf0e1 20,4%\n- Nước ngoài 4.069 2.926 \uf0e1 39,1%\nLợi nhuận gộp 6,896 5,194 \uf0e1 32,8%\n% Biên LNG 42.7% 40.1% \uf0e1 260 đcb\nLợi nhuận sau thuế 2,458 1,587 \uf0e1 54,9%\n% Biên LNST 15.2% 12.2% \uf0e1 300 đcb\nEBITDA 3,670 2,538 \uf0e1 44.6%\n% Biên EBITDA 22.7% 19.6% \uf0e1 310 đcb\nEPS (đồng/cổ phiếu) 1.051 674 \uf0e1 55,9%\n\nKết quả kinh doanh quý 1/2026 tăng trưởng tích cực so với cùng kỳ nhờ các yếu\ntố chính như sau:\n▪ Doanh thu nội địa là động lực chính cho sự tăng trưởng sau khi việc tái cấu\ntrúc hệ thống phân phối, bao gồm đánh giá lại nhà phân phối (“NPP”) và đội\nngũ kinh doanh kênh truyền thống thực hiện trong quý 1/2025 cơ bản đã\nhoàn thành. Các điểm nổi bật đáng chú ý trong hoạt động kinh doanh nội\nđịa :\n\ni. Nội lực vững chắc từ các ngành hàng cốt lõi: Sự khởi sắc trong quý\nnày ghi nhận đóng góp quan trọng từ các ngành hàng trọng tâm,\nđóng vai trò là nền tảng tăng trưởng bền vững cho Công ty. Trong\nđó, ngành sữa nước cho thấy sự phục hồi tích cực, đặc biệt là dòng\nsữa tươi 100% nhờ nỗ lực không ngừng cải thiện chất lượng.\n\nii. Tiên phong chuẩn hóa xu hướng dinh dưỡng và sức khỏe: Vinamilk tiếp tục khẳng định vai trò\ndẫn dắt thị trường bằng việc đáp ứng tốt xu hướng “ít đường, cao đạm” và tối ưu hóa hàm lượng\ndinh dưỡng toàn danh mục.\n\niii. Khai phá không gian tiêu dùng và nâng tầm dịch vụ: Công ty tích cực đa dạng hóa dư địa tiêu\ndùng thông qua dòng sản phẩm như Whipping Cream, nhằm phục vụ nhu cầu ẩm thực và pha\nchế chuyên nghiệp. Bên cạnh đó, việc triển khai Vinamilk Care – dịch vụ chăm sóc và cung ứng\nchuyên biệt các sản phẩm dinh dưỡng cho người lớn tuổi như Sure CanxiPro, SureGold & Sure\nDiacerni (chi tiết tại: Vinamilk Care | Vinamilk) được xem là bước đi chiến lược nhằm cá nhân\nhóa trải nghiệm và tối ưu hóa hành trình mua sắm, từ đó cũng cố sự gắn kết và niềm tin của\nngười tiêu dùng với thương hiệu Vinamilk.\n\niv. Tăng trưởng mạnh mẽ ở các kênh bán hàng: Toàn bộ các kênh bán hàng chính đều ghi nhận\ntăng trưởng 2 chữ số so với cùng kỳ 2025, với sự phục hồi rõ nét của kênh truyền thống cùng\nđà tăng bứt phá bền bỉ của các kênh hiện đại, hệ thống cửa hàng Vinamilk và Thương mại điện\ntử. Đặc biệt, ngày 30/03/2026, Vinamilk đã chính thức khai trương cửa hàng Flagship tại Phnom\nPenh, Campuchia.\n\nKinh doanh quốc tế: Doanh thu thuần hợp nhất từ thị trường nước ngoài đạt 4.069 tỷ đồng, tăng 39,1%\nso với cùng kỳ. Các hoạt động nổi bật về hoạt động xuất khẩu như sau:\ni. Hoạt động kinh doanh tại thị trường trọng điểm và tiềm năng đều ghi nhận những dấu hiệu tích\ncực: Tại thị trường khu vực Trung Đông vẫn ghi nhận tăng trưởng ổn định bất chấp những biến\nđộng của bối cảnh chung. Điều này cho thấy nhu cầu đối với các sản phẩm dinh dưỡng thiết\nyếu của Vinamilk vẫn hiện hữu mạnh mẽ, khẳng định sự tin tưởng của khách hàng vào chất\nlượng và uy tín thương hiệu đã xây dựng lâu năm. Bên cạnh đó, các khu vực thị trường tiềm\nnăng khác cũng đóng góp tích cực vào kết quả xuất khẩu chung, giúp công ty đa dạng hóa\nnguồn thu và củng cố vị thế trên thị trường quốc tế. Thị trường Trung Quốc cũng đang dần trở\nthành động lực tăng trưởng quan trọng khi các dòng sản phẩm chủ lực như sữa đặc và sữa chua\nđạt được độ phủ cao và sự đón nhận tích cực từ người tiêu dùng.\n\nii. Linh hoạt ứng phó với tình hình địa chính trị: Trước những diễn biến của tình hình địa chính trị\ngây áp lực lên chi phí và thời gian vận chuyển quốc tế, Vinamilk đã chủ động triển khai các kịch\nbản ứng phó để đảm bảo tính liên tục của chuỗi cung ứng. Cụ thể, Công ty đã thiết lập các\ntuyến đường vận chuyển thay thế thông qua Jordan thay vì đi qua eo biển Hormuz nhằm đưa\nhàng hóa tới tay đối tác kịp thời. Dù giá cước vận tải tăng cao và ảnh hưởng tới biên lợi nhuận,\nVinamilk vẫn kiên trì với mục tiêu sát cánh cùng khách hàng trong giai đoạn khó khăn nhất. Đây\nlà nỗ lực nhằm duy trì sự hiện diện bền vững của thương hiệu, đảm bảo nguồn cung sản phẩm\nkhông bị gián đoạn và củng cố mối quan hệ hợp tác dài hạn với các đối tác quốc tế. Về dài hạn,\nCông ty tiếp tục chiến lược đa dạng hóa thị trường quốc tế và mở rộng nguồn cung nguyên liệu\nnhằm giảm phụ thuộc và hạn chế tối đa tác động đến hoạt động kinh doanh.\n\niii. Tiếp tục tối ưu hóa danh mục sản phẩm nâng cao năng lực cạnh tranh: Năng lực nghiên cứu và\nphát triển (R&D) tiếp tục được phát huy để tạo ra các dòng sản phẩm phù hợp.', 'Title: KẾT QUẢ CUỘC HỌP ĐHĐCĐ THƯỜNG NIÊN NGÀY 22/04/2026\nSource: 20260429_VNM_Ban_tin_NDT_Q1_2026.pdf\nKẾT QUẢ CUỘC HỌP ĐHĐCĐ THƯỜNG NIÊN NGÀY 22/04/2026\n\nĐại Hội Đồng Cổ Đông thường niên năm 2026 đã thông qua kế hoạch doanh thu và lợi nhuận sau\nthuế lần lượt là 66.477 tỷ đồng và 9.828 tỷ đồng, tăng trưởng 4,3% và 4,4% so với cùng kỳ. Đại\nhội đã thông qua mức cổ tức bằng tiền đợt cuối năm 2025 là 1.850 đồng/cổ phiếu, tương đương\ntổng mức cổ tức năm 2025 là 4.350 đồng/cổ phiếu, ngang so với cùng kỳ. Đại hội cũng phê duyệt\nkế hoạch cổ tức bằng tiền năm 2026 tối thiểu bằng 50% kế hoạch lợi nhuận sau thuế. Kết quả\ncuộc họp ĐHĐCĐ thường niên 2026 đã được Công ty công bố đầy đủ và chi tiết như sau:\n- Biên bản đại hội : https://www.vinamilk.com.vn/investor/reports/agm\n- Nghị quyết đại hội: https://www.vinamilk.com.vn/investor/reports/agm', 'Title: SỰ KIỆN SẮP DIỄN RA\nSource: 20260429_VNM_Ban_tin_NDT_Q1_2026.pdf\nSỰ KIỆN SẮP DIỄN RA\n\nVào 8:00 ngày 08/05/2026 (giờ Việt Nam), Công ty sẽ tổ chức cuộc họp để trao đổi về kết quả kinh\ndoanh Q1/2026 với sự tham gia của ban Quan hệ Nhà đầu tư. Đăng ký tham gia tại ĐÂY.\nTài liệu liên quan đến cuộc họp là Báo cáo tài chính đã được công bố trên trang Quan hệ Nhà đầu tư\ncủa Công ty tại ĐÂY.\n\nLưu ý miễn trừ trách nhiệm:\nMột số báo cáo trong Bản tin Nhà đầu tư này có thể bao gồm “các nhận định trong tương lai”, bao gồm cả thông tin tài chính dự phóng.\nCác báo cáo và thông tin tài chính dự phóng này chứa đựng các rủi ro đã biết và chưa biết, các yếu tố không chắc chắn và các yếu tố\nkhác có thể khiến kết quả thực tế, hiệu suất hoặc thành tích của Công ty Cổ phần Sữa Việt Nam (“VNM” hoặc “Công ty”), hoặc các kết\nquả ngành, có sự khác biệt trọng yếu so với bất kỳ kết quả, hiệu suất hoặc thành tích nào trong tương lai được thể hiện hoặc ngụ ý bởi\ncác báo cáo và thông tin tài chính dự phóng. Các báo cáo và thông tin tài chính dự phóng dựa trên nhiều giả định liên quan đến chiến\nlược kinh doanh hiện tại và tương lai của VNM và môi trường mà VNM sẽ hoạt động trong tương lai. Vì những báo cáo và thông tin tài\nchính này phản ánh quan điểm hiện tại của VNM về các sự kiện trong tương lai, những báo cáo và thông tin tài chính này có chứa đựng\nrủi ro, sự không chắc chắn và các giả định. Kết quả thực tế trong tương lai có thể khác biệt trọng yếu với các báo cáo và thông tin tài\nchính dự phóng này.\nVNM từ chối mọi nghĩa vụ hoặc cam kết phát hành công khai bất kỳ cập nhật hoặc sửa đổi nào đối với bất kỳ tuyên bố hoặc thông tin\ntài chính dự phóng được đề cập trong Bản tin Nhà đầu tư này để phản ánh bất kỳ thay đổi nào trong các kỳ vọng của VNM đến bất kỳ\nthay đổi nào trong các sự kiện, điều kiện hoặc hoàn cảnh mà các tuyên bố hoặc thông tin được dựa trên.\nBản tin Nhà đầu tư này bao gồm dữ liệu thị trường và ngành và dự báo thu được từ khảo sát nội bộ, báo cáo và các nghiên cứu phù\nhợp, cũng như nghiên cứu thị trường, thông tin có sẵn công khai và các ấn phẩm ngành. Các ấn phẩm ngành, khảo sát và dự báo nhìn\nchung nói rằng thông tin họ cung cấp được lấy từ các nguồn được cho là đáng tin cậy, nhưng không thể đảm bảo tính chính xác hoặc\nđầy đủ của thông tin được sử dụng. Mặc dù VNM đã thực hiện các bước hợp lý để đảm bảo rằng thông tin được trích xuất chính xác\nvà trong bối cảnh phù hợp, nhưng VNM chưa xác minh độc lập bất kỳ dữ liệu nào từ các nguồn của bên thứ ba hoặc xác định các giả\nđịnh kinh tế cơ bản liên quan.', 'Title: Biên lợi nhuận: Bao gồm lợi nhuận gộp (biên LNG), biên lợi nhuận sau thuế (biên LNST) và biên lợi\nSource: 20260429_VNM_Ban_tin_NDT_Q1_2026.pdf\nBiên lợi nhuận: Bao gồm lợi nhuận gộp (biên LNG), biên lợi nhuận sau thuế (biên LNST) và biên lợi\n\nnhuận trước thuế và khấu hao (biên EBITDA) đều tăng trưởng tốt vì 02 yếu tố chính:\ni. Doanh thu tăng trưởng.\n\nii. Chi phí hoạt động được kiểm soát phù hợp và tăng ít hơn doanh thu.\n\nKết quả hoạt động của các công ty thành viên:\ni. Sữa Mộc Châu (HOSE: MCM) đã tạo cú hích mạnh mẽ trong Q1/2026, cụ thể doanh thu thuần\nvà lợi nhuận sau thuế lần lượt đạt 742 tỷ đồng và 80 tỷ đồng, tăng trưởng 25,2% và 67,8% so\nvới cùng kỳ. Sự bứt phá này là kết quả của một chiến lược quản trị chi phí tối ưu và tinh gọn\nchuỗi cung ứng. Đặc biệt, năm 2026 đánh dấu bước ngoặt lớn khi Mộc Châu Milk quyết tâm đẩy\nmạnh mở rộng mạng lưới phân phối vào thị trường miền Nam đầy tiềm năng và hướng tầm nhìn\nra thị trường quốc tế.\n\nMCM đã giới thiệu thương hiệu mới là Mộc Châu Creamery nhằm hướng tới cao cấp hóa sản\nphẩm của mình và đã nhận được phản hồi tích cực của người tiêu dùng.\n\nMCM đã tổ chức thành công Đại Hội Đồng Cổ Đông Thường Niên năm 2026 vào ngày\n20/4/2026, thông qua kế hoạch doanh thu 3.126,4 tỷ đồng và lợi nhuận sau thuế 241 tỷ đồng,\ntăng trưởng lần lượt 10,3% và 11,7% so với cùng kỳ.\n\nii. Angkor Milk tiếp tục tăng trưởng vượt bậc khi doanh thu tăng gần gấp 3 lần và lợi nhuận tăng\ngấp hơn 2,5 lần so với cùng kỳ. Thành quả này đến từ sự tăng trưởng mạnh mẽ về sản lượng,\ncho thấy được nhu cầu thị trường ở Campuchia đối với các sản phẩm từ Vinamilk đang ở mức\ncao.\n\niii. Driftwood với doanh thu giảm ~ 5% do điều chỉnh theo cơ chế giá thỏa thuận với khách hàng\nkhi giá sữa tươi nguyên liệu giảm, trong khi sản lượng tiêu thụ vẫn được duy trì ổn định. Tuy\nnhiên, LNST tăng gần ~25%.\nVới các kết quả trên, Công ty đã hoàn thành kế hoạch tổng doanh thu và lợi nhuận sau thuế năm 2026\nlần lượt là 24,3% và 25,0%.', 'Title: BẢN TIN NHÀ ĐẦU TƯ\nSource: 20260429_VNM_Ban_tin_NDT_Q1_2026.pdf\nBẢN TIN NHÀ ĐẦU TƯ\n\nTp. Hồ Chí Minh, ngày 29 tháng 04 năm 2026\nQUÝ 1/2026\n\nCông ty phát hành Bản tin nhà đầu tư, cùng ngày công bố thông tin báo cáo tài\nchính quý sau khi đã được soát xét bởi Công ty kiểm toán KPMG, nhằm cung\ncấp cho cổ đông, nhà đầu tư và các bên có liên quan về kết quả kinh doanh,\ntình hình tài chính và các sự kiện nổi bật của Tập đoàn Vinamilk trong quý\n1/2026 một cách đầy đủ, minh bạch và kịp thời.\n\nNgày 22/04/2026, Công ty đã tổ chức Đại hội đồng cổ đông thường niên thành\ncông. Theo đó, HĐQT đã chia sẻ nhiều thông tin quan trọng liên quan đến tình\nhình hoạt động sản xuất kinh doanh của Công ty năm 2025, chi trả cổ tức năm\n2025, kế hoạch kinh doanh 2026 (bao gồm kế hoạch chi trả cổ tức 2026),… Do\nđó, Bản tin kỳ này của Công ty sẽ bao gồm những nội dung sau đây:']",Cuộc họp để trao đổi về kết quả kinh doanh Q1/2026 sẽ diễn ra vào ngày 08/05/2026.,Cuộc họp sẽ diễn ra vào ngày 08/05/2026.,1.0,0.9250421605293667,0.3333333333,1.0,0.8,False,
Vào thời gian nào cuộc họp sẽ diễn ra (giờ Việt Nam)?,"['Title: SỰ KIỆN SẮP DIỄN RA\nSource: 20260429_VNM_Ban_tin_NDT_Q1_2026.pdf\nSỰ KIỆN SẮP DIỄN RA\n\nVào 8:00 ngày 08/05/2026 (giờ Việt Nam), Công ty sẽ tổ chức cuộc họp để trao đổi về kết quả kinh\ndoanh Q1/2026 với sự tham gia của ban Quan hệ Nhà đầu tư. Đăng ký tham gia tại ĐÂY.\nTài liệu liên quan đến cuộc họp là Báo cáo tài chính đã được công bố trên trang Quan hệ Nhà đầu tư\ncủa Công ty tại ĐÂY.\n\nLưu ý miễn trừ trách nhiệm:\nMột số báo cáo trong Bản tin Nhà đầu tư này có thể bao gồm “các nhận định trong tương lai”, bao gồm cả thông tin tài chính dự phóng.\nCác báo cáo và thông tin tài chính dự phóng này chứa đựng các rủi ro đã biết và chưa biết, các yếu tố không chắc chắn và các yếu tố\nkhác có thể khiến kết quả thực tế, hiệu suất hoặc thành tích của Công ty Cổ phần Sữa Việt Nam (“VNM” hoặc “Công ty”), hoặc các kết\nquả ngành, có sự khác biệt trọng yếu so với bất kỳ kết quả, hiệu suất hoặc thành tích nào trong tương lai được thể hiện hoặc ngụ ý bởi\ncác báo cáo và thông tin tài chính dự phóng. Các báo cáo và thông tin tài chính dự phóng dựa trên nhiều giả định liên quan đến chiến\nlược kinh doanh hiện tại và tương lai của VNM và môi trường mà VNM sẽ hoạt động trong tương lai. Vì những báo cáo và thông tin tài\nchính này phản ánh quan điểm hiện tại của VNM về các sự kiện trong tương lai, những báo cáo và thông tin tài chính này có chứa đựng\nrủi ro, sự không chắc chắn và các giả định. Kết quả thực tế trong tương lai có thể khác biệt trọng yếu với các báo cáo và thông tin tài\nchính dự phóng này.\nVNM từ chối mọi nghĩa vụ hoặc cam kết phát hành công khai bất kỳ cập nhật hoặc sửa đổi nào đối với bất kỳ tuyên bố hoặc thông tin\ntài chính dự phóng được đề cập trong Bản tin Nhà đầu tư này để phản ánh bất kỳ thay đổi nào trong các kỳ vọng của VNM đến bất kỳ\nthay đổi nào trong các sự kiện, điều kiện hoặc hoàn cảnh mà các tuyên bố hoặc thông tin được dựa trên.\nBản tin Nhà đầu tư này bao gồm dữ liệu thị trường và ngành và dự báo thu được từ khảo sát nội bộ, báo cáo và các nghiên cứu phù\nhợp, cũng như nghiên cứu thị trường, thông tin có sẵn công khai và các ấn phẩm ngành. Các ấn phẩm ngành, khảo sát và dự báo nhìn\nchung nói rằng thông tin họ cung cấp được lấy từ các nguồn được cho là đáng tin cậy, nhưng không thể đảm bảo tính chính xác hoặc\nđầy đủ của thông tin được sử dụng. Mặc dù VNM đã thực hiện các bước hợp lý để đảm bảo rằng thông tin được trích xuất chính xác\nvà trong bối cảnh phù hợp, nhưng VNM chưa xác minh độc lập bất kỳ dữ liệu nào từ các nguồn của bên thứ ba hoặc xác định các giả\nđịnh kinh tế cơ bản liên quan.', 'Title: TÓM TẮT KẾT QUẢ KINH DOANH HỢP NHẤT Q1/2026 ĐÃ KIỂM TOÁN:\nSource: 20260429_VNM_Ban_tin_NDT_Q1_2026.pdf\nTÓM TẮT KẾT QUẢ KINH DOANH HỢP NHẤT Q1/2026 ĐÃ KIỂM TOÁN:\n\n(Tỷ đồng) Q1/2026 Q1/2025\n % tăng/\n(giảm)\nDoanh thu thuần 16.149 12.958 \uf0e1 24,6%\n- Trong nước 12.080 10.032 \uf0e1 20,4%\n- Nước ngoài 4.069 2.926 \uf0e1 39,1%\nLợi nhuận gộp 6,896 5,194 \uf0e1 32,8%\n% Biên LNG 42.7% 40.1% \uf0e1 260 đcb\nLợi nhuận sau thuế 2,458 1,587 \uf0e1 54,9%\n% Biên LNST 15.2% 12.2% \uf0e1 300 đcb\nEBITDA 3,670 2,538 \uf0e1 44.6%\n% Biên EBITDA 22.7% 19.6% \uf0e1 310 đcb\nEPS (đồng/cổ phiếu) 1.051 674 \uf0e1 55,9%\n\nKết quả kinh doanh quý 1/2026 tăng trưởng tích cực so với cùng kỳ nhờ các yếu\ntố chính như sau:\n▪ Doanh thu nội địa là động lực chính cho sự tăng trưởng sau khi việc tái cấu\ntrúc hệ thống phân phối, bao gồm đánh giá lại nhà phân phối (“NPP”) và đội\nngũ kinh doanh kênh truyền thống thực hiện trong quý 1/2025 cơ bản đã\nhoàn thành. Các điểm nổi bật đáng chú ý trong hoạt động kinh doanh nội\nđịa :\n\ni. Nội lực vững chắc từ các ngành hàng cốt lõi: Sự khởi sắc trong quý\nnày ghi nhận đóng góp quan trọng từ các ngành hàng trọng tâm,\nđóng vai trò là nền tảng tăng trưởng bền vững cho Công ty. Trong\nđó, ngành sữa nước cho thấy sự phục hồi tích cực, đặc biệt là dòng\nsữa tươi 100% nhờ nỗ lực không ngừng cải thiện chất lượng.\n\nii. Tiên phong chuẩn hóa xu hướng dinh dưỡng và sức khỏe: Vinamilk tiếp tục khẳng định vai trò\ndẫn dắt thị trường bằng việc đáp ứng tốt xu hướng “ít đường, cao đạm” và tối ưu hóa hàm lượng\ndinh dưỡng toàn danh mục.\n\niii. Khai phá không gian tiêu dùng và nâng tầm dịch vụ: Công ty tích cực đa dạng hóa dư địa tiêu\ndùng thông qua dòng sản phẩm như Whipping Cream, nhằm phục vụ nhu cầu ẩm thực và pha\nchế chuyên nghiệp. Bên cạnh đó, việc triển khai Vinamilk Care – dịch vụ chăm sóc và cung ứng\nchuyên biệt các sản phẩm dinh dưỡng cho người lớn tuổi như Sure CanxiPro, SureGold & Sure\nDiacerni (chi tiết tại: Vinamilk Care | Vinamilk) được xem là bước đi chiến lược nhằm cá nhân\nhóa trải nghiệm và tối ưu hóa hành trình mua sắm, từ đó cũng cố sự gắn kết và niềm tin của\nngười tiêu dùng với thương hiệu Vinamilk.\n\niv. Tăng trưởng mạnh mẽ ở các kênh bán hàng: Toàn bộ các kênh bán hàng chính đều ghi nhận\ntăng trưởng 2 chữ số so với cùng kỳ 2025, với sự phục hồi rõ nét của kênh truyền thống cùng\nđà tăng bứt phá bền bỉ của các kênh hiện đại, hệ thống cửa hàng Vinamilk và Thương mại điện\ntử. Đặc biệt, ngày 30/03/2026, Vinamilk đã chính thức khai trương cửa hàng Flagship tại Phnom\nPenh, Campuchia.\n\nKinh doanh quốc tế: Doanh thu thuần hợp nhất từ thị trường nước ngoài đạt 4.069 tỷ đồng, tăng 39,1%\nso với cùng kỳ. Các hoạt động nổi bật về hoạt động xuất khẩu như sau:\ni. Hoạt động kinh doanh tại thị trường trọng điểm và tiềm năng đều ghi nhận những dấu hiệu tích\ncực: Tại thị trường khu vực Trung Đông vẫn ghi nhận tăng trưởng ổn định bất chấp những biến\nđộng của bối cảnh chung. Điều này cho thấy nhu cầu đối với các sản phẩm dinh dưỡng thiết\nyếu của Vinamilk vẫn hiện hữu mạnh mẽ, khẳng định sự tin tưởng của khách hàng vào chất\nlượng và uy tín thương hiệu đã xây dựng lâu năm. Bên cạnh đó, các khu vực thị trường tiềm\nnăng khác cũng đóng góp tích cực vào kết quả xuất khẩu chung, giúp công ty đa dạng hóa\nnguồn thu và củng cố vị thế trên thị trường quốc tế. Thị trường Trung Quốc cũng đang dần trở\nthành động lực tăng trưởng quan trọng khi các dòng sản phẩm chủ lực như sữa đặc và sữa chua\nđạt được độ phủ cao và sự đón nhận tích cực từ người tiêu dùng.\n\nii. Linh hoạt ứng phó với tình hình địa chính trị: Trước những diễn biến của tình hình địa chính trị\ngây áp lực lên chi phí và thời gian vận chuyển quốc tế, Vinamilk đã chủ động triển khai các kịch\nbản ứng phó để đảm bảo tính liên tục của chuỗi cung ứng. Cụ thể, Công ty đã thiết lập các\ntuyến đường vận chuyển thay thế thông qua Jordan thay vì đi qua eo biển Hormuz nhằm đưa\nhàng hóa tới tay đối tác kịp thời. Dù giá cước vận tải tăng cao và ảnh hưởng tới biên lợi nhuận,\nVinamilk vẫn kiên trì với mục tiêu sát cánh cùng khách hàng trong giai đoạn khó khăn nhất. Đây\nlà nỗ lực nhằm duy trì sự hiện diện bền vững của thương hiệu, đảm bảo nguồn cung sản phẩm\nkhông bị gián đoạn và củng cố mối quan hệ hợp tác dài hạn với các đối tác quốc tế. Về dài hạn,\nCông ty tiếp tục chiến lược đa dạng hóa thị trường quốc tế và mở rộng nguồn cung nguyên liệu\nnhằm giảm phụ thuộc và hạn chế tối đa tác động đến hoạt động kinh doanh.\n\niii. Tiếp tục tối ưu hóa danh mục sản phẩm nâng cao năng lực cạnh tranh: Năng lực nghiên cứu và\nphát triển (R&D) tiếp tục được phát huy để tạo ra các dòng sản phẩm phù hợp.', 'Title: TÌNH HÌNH TÀI CHÍNH:\nSource: 20260429_VNM_Ban_tin_NDT_Q1_2026.pdf\nTÌNH HÌNH TÀI CHÍNH:\n\nTính đến ngày 31/03/2026, tổng tài sản của công ty đạt 55.429 tỷ đồng, trong đó tiền mặt và các\nkhoản đầu tư tài chính ngắn hạn chiếm 45,2%, đảm bảo khả năng thanh khoản ổn định.\nTrong thời gian qua, mặt bằng giá nguyên vật liệu đầu vào có xu hướng tăng, đặc biệt ở các nhóm\nnguyên liệu sữa, năng lượng và bao bì nhựa, chủ yếu do ảnh hưởng từ nguồn cung toàn cầu và các yếu\ntố địa chính trị. Trước bối cảnh đó, Công ty đã chủ động triển khai các biện pháp quản trị rủi ro, bao\ngồm xây dựng mức tồn kho an toàn và lập kế hoạch thu mua phù hợp nhằm đảm bảo nguồn cung ổn\nđịnh cho hoạt động sản xuất trong năm 2026 và giai đoạn tiếp theo.', 'Title: Tổng Quan\nSource: 20260429_VNM_Ban_tin_NDT_Q1_2026.pdf\nTổng Quan\n\nMã chứng khoán\nNiêm yết tại\nVNM\nHOSE\nNgành Sữa\nNgày niêm yết 19/01/2006\nSLCP lưu hành 2.089.955.445\nTThống kê thị trường ngày 29/04/2026:\n- Giá CP VNM tham chiếu 61.200 VND/CP\n- P/E 13,64\n- Vốn hóa Công ty 127.905 tỷ VND\n- Giới hạn % sở hữu nước\nngoài\n100%\n- Sở hữu nước ngoài hiện\ntại\n48,92%\n\nVề Vinamilk\nVinamilk là công ty dinh dưỡng hàng đầu tại\nViệt Nam và hiện xếp thứ 36 trong danh sách\ncác công ty sữa lớn nhất thế giới về quy mô\ndoanh thu. Sứ mệnh của chúng tôi là trở thành\nthương hiệu quốc tế trong lĩnh vực thực phẩm\nvà là biểu tượng niềm tin cho người tiêu dùng\nvề sản phẩm dinh dưỡng và sức khỏe. Truy cập\nwebsite để biết thêm về chúng tôi\nhttps://www.vinamilk.com.vn/\nLiên hệ:\nCổ đông và Quan hệ nhà đầu tư\nÔng Trần Chí Sơn, Trưởng BP Tài chính/Thư ký\nCông ty\ntcson@vinamilk.com.vn\nÔng Phạm Anh Tuấn, Chuyên viên IR\npatuan2@vinamilk.com.vn\nBáo chí & Truyền thông\nÔng Đỗ Thanh Tuấn, Giám đốc Đối ngoại\ndothanhtuan@vinamilk.com.vn\nChuyên viên phân tích độc lập\nVinh Bui vinh.bui@vietcap.com.vn\nNhan Tran nhan.tran@maybank.com\nMinh Dang minhdt1@ssi.com.vn\nMy Tran my.th@hsc.com.vn\nMcrid Wang mcrid.wang@bofa.com\nTrang Nguyen trang-za.nguyen@ubs.com\nSelviana Aripin selviana.aripin@hsbc.com.sg\nDi Luu di.luu@yuanta.com.vn\nHung Nguyen hung.nb@vdsc.com.vn\nLy Nguyen Ly.NguyenQuynh@mbs.com.vn\nHoa Duong hoaduong@phs.vn', 'Title: CÁC CHỈ SỐ LỢI NHUẬN VÀ THANH KHOẢN:\nSource: 20260429_VNM_Ban_tin_NDT_Q1_2026.pdf\nCÁC CHỈ SỐ LỢI NHUẬN VÀ THANH KHOẢN:\n\n12T gần nhất\nđến 31/03/2026\n12T gần nhất\nđến 31/03/2025\nROE 27,7% 24,0%\nROA 18,6% 16,6%\nROIC 27,8% 23,2%\nSố ngày hàng tồn kho 66 69\nSố ngày phải thu 26 29\nSố ngày phải trả 39 40\n\nNhìn chung, tình hình tài chính của Công ty luôn được duy trì trong trạng thái kiểm soát tốt và lành\nmạnh.']",Cuộc họp sẽ diễn ra vào 8:00 ngày 08/05/2026 (giờ Việt Nam).,Cuộc họp sẽ diễn ra vào 8:00 (giờ Việt Nam).,1.0,0.8625983773242248,0.9999999999,1.0,0.86,False,
Công ty nào sẽ tổ chức cuộc họp?,"['Title: SỰ KIỆN SẮP DIỄN RA\nSource: 20260429_VNM_Ban_tin_NDT_Q1_2026.pdf\nSỰ KIỆN SẮP DIỄN RA\n\nVào 8:00 ngày 08/05/2026 (giờ Việt Nam), Công ty sẽ tổ chức cuộc họp để trao đổi về kết quả kinh\ndoanh Q1/2026 với sự tham gia của ban Quan hệ Nhà đầu tư. Đăng ký tham gia tại ĐÂY.\nTài liệu liên quan đến cuộc họp là Báo cáo tài chính đã được công bố trên trang Quan hệ Nhà đầu tư\ncủa Công ty tại ĐÂY.\n\nLưu ý miễn trừ trách nhiệm:\nMột số báo cáo trong Bản tin Nhà đầu tư này có thể bao gồm “các nhận định trong tương lai”, bao gồm cả thông tin tài chính dự phóng.\nCác báo cáo và thông tin tài chính dự phóng này chứa đựng các rủi ro đã biết và chưa biết, các yếu tố không chắc chắn và các yếu tố\nkhác có thể khiến kết quả thực tế, hiệu suất hoặc thành tích của Công ty Cổ phần Sữa Việt Nam (“VNM” hoặc “Công ty”), hoặc các kết\nquả ngành, có sự khác biệt trọng yếu so với bất kỳ kết quả, hiệu suất hoặc thành tích nào trong tương lai được thể hiện hoặc ngụ ý bởi\ncác báo cáo và thông tin tài chính dự phóng. Các báo cáo và thông tin tài chính dự phóng dựa trên nhiều giả định liên quan đến chiến\nlược kinh doanh hiện tại và tương lai của VNM và môi trường mà VNM sẽ hoạt động trong tương lai. Vì những báo cáo và thông tin tài\nchính này phản ánh quan điểm hiện tại của VNM về các sự kiện trong tương lai, những báo cáo và thông tin tài chính này có chứa đựng\nrủi ro, sự không chắc chắn và các giả định. Kết quả thực tế trong tương lai có thể khác biệt trọng yếu với các báo cáo và thông tin tài\nchính dự phóng này.\nVNM từ chối mọi nghĩa vụ hoặc cam kết phát hành công khai bất kỳ cập nhật hoặc sửa đổi nào đối với bất kỳ tuyên bố hoặc thông tin\ntài chính dự phóng được đề cập trong Bản tin Nhà đầu tư này để phản ánh bất kỳ thay đổi nào trong các kỳ vọng của VNM đến bất kỳ\nthay đổi nào trong các sự kiện, điều kiện hoặc hoàn cảnh mà các tuyên bố hoặc thông tin được dựa trên.\nBản tin Nhà đầu tư này bao gồm dữ liệu thị trường và ngành và dự báo thu được từ khảo sát nội bộ, báo cáo và các nghiên cứu phù\nhợp, cũng như nghiên cứu thị trường, thông tin có sẵn công khai và các ấn phẩm ngành. Các ấn phẩm ngành, khảo sát và dự báo nhìn\nchung nói rằng thông tin họ cung cấp được lấy từ các nguồn được cho là đáng tin cậy, nhưng không thể đảm bảo tính chính xác hoặc\nđầy đủ của thông tin được sử dụng. Mặc dù VNM đã thực hiện các bước hợp lý để đảm bảo rằng thông tin được trích xuất chính xác\nvà trong bối cảnh phù hợp, nhưng VNM chưa xác minh độc lập bất kỳ dữ liệu nào từ các nguồn của bên thứ ba hoặc xác định các giả\nđịnh kinh tế cơ bản liên quan.', 'Title: Tổng Quan\nSource: 20260429_VNM_Ban_tin_NDT_Q1_2026.pdf\nTổng Quan\n\nMã chứng khoán\nNiêm yết tại\nVNM\nHOSE\nNgành Sữa\nNgày niêm yết 19/01/2006\nSLCP lưu hành 2.089.955.445\nTThống kê thị trường ngày 29/04/2026:\n- Giá CP VNM tham chiếu 61.200 VND/CP\n- P/E 13,64\n- Vốn hóa Công ty 127.905 tỷ VND\n- Giới hạn % sở hữu nước\nngoài\n100%\n- Sở hữu nước ngoài hiện\ntại\n48,92%\n\nVề Vinamilk\nVinamilk là công ty dinh dưỡng hàng đầu tại\nViệt Nam và hiện xếp thứ 36 trong danh sách\ncác công ty sữa lớn nhất thế giới về quy mô\ndoanh thu. Sứ mệnh của chúng tôi là trở thành\nthương hiệu quốc tế trong lĩnh vực thực phẩm\nvà là biểu tượng niềm tin cho người tiêu dùng\nvề sản phẩm dinh dưỡng và sức khỏe. Truy cập\nwebsite để biết thêm về chúng tôi\nhttps://www.vinamilk.com.vn/\nLiên hệ:\nCổ đông và Quan hệ nhà đầu tư\nÔng Trần Chí Sơn, Trưởng BP Tài chính/Thư ký\nCông ty\ntcson@vinamilk.com.vn\nÔng Phạm Anh Tuấn, Chuyên viên IR\npatuan2@vinamilk.com.vn\nBáo chí & Truyền thông\nÔng Đỗ Thanh Tuấn, Giám đốc Đối ngoại\ndothanhtuan@vinamilk.com.vn\nChuyên viên phân tích độc lập\nVinh Bui vinh.bui@vietcap.com.vn\nNhan Tran nhan.tran@maybank.com\nMinh Dang minhdt1@ssi.com.vn\nMy Tran my.th@hsc.com.vn\nMcrid Wang mcrid.wang@bofa.com\nTrang Nguyen trang-za.nguyen@ubs.com\nSelviana Aripin selviana.aripin@hsbc.com.sg\nDi Luu di.luu@yuanta.com.vn\nHung Nguyen hung.nb@vdsc.com.vn\nLy Nguyen Ly.NguyenQuynh@mbs.com.vn\nHoa Duong hoaduong@phs.vn', 'Title: TÓM TẮT KẾT QUẢ KINH DOANH HỢP NHẤT Q1/2026 ĐÃ KIỂM TOÁN:\nSource: 20260429_VNM_Ban_tin_NDT_Q1_2026.pdf\nTÓM TẮT KẾT QUẢ KINH DOANH HỢP NHẤT Q1/2026 ĐÃ KIỂM TOÁN:\n\n(Tỷ đồng) Q1/2026 Q1/2025\n % tăng/\n(giảm)\nDoanh thu thuần 16.149 12.958 \uf0e1 24,6%\n- Trong nước 12.080 10.032 \uf0e1 20,4%\n- Nước ngoài 4.069 2.926 \uf0e1 39,1%\nLợi nhuận gộp 6,896 5,194 \uf0e1 32,8%\n% Biên LNG 42.7% 40.1% \uf0e1 260 đcb\nLợi nhuận sau thuế 2,458 1,587 \uf0e1 54,9%\n% Biên LNST 15.2% 12.2% \uf0e1 300 đcb\nEBITDA 3,670 2,538 \uf0e1 44.6%\n% Biên EBITDA 22.7% 19.6% \uf0e1 310 đcb\nEPS (đồng/cổ phiếu) 1.051 674 \uf0e1 55,9%\n\nKết quả kinh doanh quý 1/2026 tăng trưởng tích cực so với cùng kỳ nhờ các yếu\ntố chính như sau:\n▪ Doanh thu nội địa là động lực chính cho sự tăng trưởng sau khi việc tái cấu\ntrúc hệ thống phân phối, bao gồm đánh giá lại nhà phân phối (“NPP”) và đội\nngũ kinh doanh kênh truyền thống thực hiện trong quý 1/2025 cơ bản đã\nhoàn thành. Các điểm nổi bật đáng chú ý trong hoạt động kinh doanh nội\nđịa :\n\ni. Nội lực vững chắc từ các ngành hàng cốt lõi: Sự khởi sắc trong quý\nnày ghi nhận đóng góp quan trọng từ các ngành hàng trọng tâm,\nđóng vai trò là nền tảng tăng trưởng bền vững cho Công ty. Trong\nđó, ngành sữa nước cho thấy sự phục hồi tích cực, đặc biệt là dòng\nsữa tươi 100% nhờ nỗ lực không ngừng cải thiện chất lượng.\n\nii. Tiên phong chuẩn hóa xu hướng dinh dưỡng và sức khỏe: Vinamilk tiếp tục khẳng định vai trò\ndẫn dắt thị trường bằng việc đáp ứng tốt xu hướng “ít đường, cao đạm” và tối ưu hóa hàm lượng\ndinh dưỡng toàn danh mục.\n\niii. Khai phá không gian tiêu dùng và nâng tầm dịch vụ: Công ty tích cực đa dạng hóa dư địa tiêu\ndùng thông qua dòng sản phẩm như Whipping Cream, nhằm phục vụ nhu cầu ẩm thực và pha\nchế chuyên nghiệp. Bên cạnh đó, việc triển khai Vinamilk Care – dịch vụ chăm sóc và cung ứng\nchuyên biệt các sản phẩm dinh dưỡng cho người lớn tuổi như Sure CanxiPro, SureGold & Sure\nDiacerni (chi tiết tại: Vinamilk Care | Vinamilk) được xem là bước đi chiến lược nhằm cá nhân\nhóa trải nghiệm và tối ưu hóa hành trình mua sắm, từ đó cũng cố sự gắn kết và niềm tin của\nngười tiêu dùng với thương hiệu Vinamilk.\n\niv. Tăng trưởng mạnh mẽ ở các kênh bán hàng: Toàn bộ các kênh bán hàng chính đều ghi nhận\ntăng trưởng 2 chữ số so với cùng kỳ 2025, với sự phục hồi rõ nét của kênh truyền thống cùng\nđà tăng bứt phá bền bỉ của các kênh hiện đại, hệ thống cửa hàng Vinamilk và Thương mại điện\ntử. Đặc biệt, ngày 30/03/2026, Vinamilk đã chính thức khai trương cửa hàng Flagship tại Phnom\nPenh, Campuchia.\n\nKinh doanh quốc tế: Doanh thu thuần hợp nhất từ thị trường nước ngoài đạt 4.069 tỷ đồng, tăng 39,1%\nso với cùng kỳ. Các hoạt động nổi bật về hoạt động xuất khẩu như sau:\ni. Hoạt động kinh doanh tại thị trường trọng điểm và tiềm năng đều ghi nhận những dấu hiệu tích\ncực: Tại thị trường khu vực Trung Đông vẫn ghi nhận tăng trưởng ổn định bất chấp những biến\nđộng của bối cảnh chung. Điều này cho thấy nhu cầu đối với các sản phẩm dinh dưỡng thiết\nyếu của Vinamilk vẫn hiện hữu mạnh mẽ, khẳng định sự tin tưởng của khách hàng vào chất\nlượng và uy tín thương hiệu đã xây dựng lâu năm. Bên cạnh đó, các khu vực thị trường tiềm\nnăng khác cũng đóng góp tích cực vào kết quả xuất khẩu chung, giúp công ty đa dạng hóa\nnguồn thu và củng cố vị thế trên thị trường quốc tế. Thị trường Trung Quốc cũng đang dần trở\nthành động lực tăng trưởng quan trọng khi các dòng sản phẩm chủ lực như sữa đặc và sữa chua\nđạt được độ phủ cao và sự đón nhận tích cực từ người tiêu dùng.\n\nii. Linh hoạt ứng phó với tình hình địa chính trị: Trước những diễn biến của tình hình địa chính trị\ngây áp lực lên chi phí và thời gian vận chuyển quốc tế, Vinamilk đã chủ động triển khai các kịch\nbản ứng phó để đảm bảo tính liên tục của chuỗi cung ứng. Cụ thể, Công ty đã thiết lập các\ntuyến đường vận chuyển thay thế thông qua Jordan thay vì đi qua eo biển Hormuz nhằm đưa\nhàng hóa tới tay đối tác kịp thời. Dù giá cước vận tải tăng cao và ảnh hưởng tới biên lợi nhuận,\nVinamilk vẫn kiên trì với mục tiêu sát cánh cùng khách hàng trong giai đoạn khó khăn nhất. Đây\nlà nỗ lực nhằm duy trì sự hiện diện bền vững của thương hiệu, đảm bảo nguồn cung sản phẩm\nkhông bị gián đoạn và củng cố mối quan hệ hợp tác dài hạn với các đối tác quốc tế. Về dài hạn,\nCông ty tiếp tục chiến lược đa dạng hóa thị trường quốc tế và mở rộng nguồn cung nguyên liệu\nnhằm giảm phụ thuộc và hạn chế tối đa tác động đến hoạt động kinh doanh.\n\niii. Tiếp tục tối ưu hóa danh mục sản phẩm nâng cao năng lực cạnh tranh: Năng lực nghiên cứu và\nphát triển (R&D) tiếp tục được phát huy để tạo ra các dòng sản phẩm phù hợp.', 'Title: CÁC CHỈ SỐ LỢI NHUẬN VÀ THANH KHOẢN:\nSource: 20260429_VNM_Ban_tin_NDT_Q1_2026.pdf\nCÁC CHỈ SỐ LỢI NHUẬN VÀ THANH KHOẢN:\n\n12T gần nhất\nđến 31/03/2026\n12T gần nhất\nđến 31/03/2025\nROE 27,7% 24,0%\nROA 18,6% 16,6%\nROIC 27,8% 23,2%\nSố ngày hàng tồn kho 66 69\nSố ngày phải thu 26 29\nSố ngày phải trả 39 40\n\nNhìn chung, tình hình tài chính của Công ty luôn được duy trì trong trạng thái kiểm soát tốt và lành\nmạnh.', 'Title: TÌNH HÌNH TÀI CHÍNH:\nSource: 20260429_VNM_Ban_tin_NDT_Q1_2026.pdf\nTÌNH HÌNH TÀI CHÍNH:\n\nTính đến ngày 31/03/2026, tổng tài sản của công ty đạt 55.429 tỷ đồng, trong đó tiền mặt và các\nkhoản đầu tư tài chính ngắn hạn chiếm 45,2%, đảm bảo khả năng thanh khoản ổn định.\nTrong thời gian qua, mặt bằng giá nguyên vật liệu đầu vào có xu hướng tăng, đặc biệt ở các nhóm\nnguyên liệu sữa, năng lượng và bao bì nhựa, chủ yếu do ảnh hưởng từ nguồn cung toàn cầu và các yếu\ntố địa chính trị. Trước bối cảnh đó, Công ty đã chủ động triển khai các biện pháp quản trị rủi ro, bao\ngồm xây dựng mức tồn kho an toàn và lập kế hoạch thu mua phù hợp nhằm đảm bảo nguồn cung ổn\nđịnh cho hoạt động sản xuất trong năm 2026 và giai đoạn tiếp theo.']",Công ty Cổ phần Sữa Việt Nam (VNM) sẽ tổ chức cuộc họp.,Công ty Cổ phần Sữa Việt Nam (VNM) sẽ tổ chức cuộc họp.,1.0,0.8096962192287824,0.99999999998,1.0,1.0,False,
